{
  "schema_version": "1.0.0",
  "generated_on": "2026-06-28",
  "project": "ASH Model",
  "assets": [
    {
      "path": "config/ash_r011_finite_observer_limit_contract.json",
      "original_path": null,
      "role": "documentation-asset",
      "format": "json",
      "description": "Roadmap 011 finite-observer limit normalized scale and boundary contract.",
      "size_bytes": 621,
      "checksum_sha256": "61b3ef65ab5144a2603033ccaa1233a0b30101267b59dc7be9be0360bd435193",
      "sensitivity": "public",
      "provenance": "Repository-maintained documentation for the Roadmap 011 finite-observer limit closure.",
      "license": "repository LICENSE",
      "usage_restrictions": "Finite-observer limit artifact only; do not treat as a differentiable continuum, Lorentzian metric, physical light cone, Einstein equations, FRW/LCDM dynamics, physical perturbation, CMB/matter-spectrum, external likelihood, empirical-cosmology, or locked-prediction evidence.",
      "tracked_with": "git",
      "validation_status": "passed",
      "notes": "Manifest entry generated from the tracked repository file on 2026-06-26."
    },
    {
      "path": "config/ash_r012_background_contract.json",
      "original_path": null,
      "role": "documentation-asset",
      "format": "json",
      "description": "Roadmap 012 synthetic background-equation calibration and boundary contract.",
      "size_bytes": 885,
      "checksum_sha256": "ed087e5300a1667b5f3c57008bc030ecaa6ac14850a4cc4ac4132bf6917fc772",
      "sensitivity": "public",
      "provenance": "Repository-maintained documentation for the Roadmap 012 synthetic finite-observer background-equation workbench.",
      "license": "repository LICENSE",
      "usage_restrictions": "Synthetic finite-observer background-equation workbench only; do not treat as a physical FRW continuum, Einstein-equation derivation, external likelihood, empirical cosmology validation, CMB/matter-spectrum, modified-gravity, dark-sector detection, or locked-prediction evidence.",
      "tracked_with": "git",
      "validation_status": "passed",
      "notes": "Manifest entry generated from the tracked repository file on 2026-06-28."
    },
    {
      "path": "config/ash_r013_perturbation_contract.json",
      "original_path": null,
      "role": "documentation-asset",
      "format": "json",
      "description": "Roadmap 013 perturbation workbench calibration and boundary contract.",
      "size_bytes": 1425,
      "checksum_sha256": "50101b821822879f598f47faffb7bd0f413a1fc4a5a57c5b3bf5a4f01787f1ed",
      "sensitivity": "public",
      "provenance": "Repository-maintained documentation for the Roadmap 013 bounded physical perturbation workbench.",
      "license": "repository LICENSE",
      "usage_restrictions": "Synthetic/proxy physical perturbation workbench only; do not treat as a full photon-baryon Boltzmann hierarchy, CLASS/CAMB replacement, external likelihood, empirical CMB/matter validation, survey-calibrated spectrum, or locked-prediction evidence.",
      "tracked_with": "git",
      "validation_status": "passed",
      "notes": "Manifest entry generated from the tracked repository file on 2026-06-28."
    },
    {
      "path": "config/ash_r014_data_product_registry.json",
      "original_path": null,
      "role": "documentation-asset",
      "format": "json",
      "description": "Roadmap 014 metadata-only reviewed external data-product registry.",
      "size_bytes": 1460,
      "checksum_sha256": "6ad012c0e3c23cd19d536290669562004208b5c1932309c93365fdf973e3dc7b",
      "sensitivity": "public",
      "provenance": "Produced by tools/generate_external_likelihoods.py from tracked R-014 source code and configuration.",
      "license": "repository LICENSE",
      "usage_restrictions": "External-likelihood readiness and deterministic synthetic fixture only; do not treat as bundled third-party observational data, official Planck/Pantheon+/DESI/BOSS likelihood scoring, empirical validation, ASH preference evidence, or locked-prediction evidence.",
      "tracked_with": "git",
      "validation_status": "passed",
      "notes": "Manifest entry generated from the tracked repository file on 2026-06-28."
    },
    {
      "path": "config/ash_r014_likelihood_contract.json",
      "original_path": null,
      "role": "documentation-asset",
      "format": "json",
      "description": "Roadmap 014 Gaussian likelihood, matched-baseline, and boundary contract.",
      "size_bytes": 1571,
      "checksum_sha256": "e26a66bd68e3d38be5347814764d597e139f7146d74136c16f185734f3ab786b",
      "sensitivity": "public",
      "provenance": "Produced by tools/generate_external_likelihoods.py from tracked R-014 source code and configuration.",
      "license": "repository LICENSE",
      "usage_restrictions": "External-likelihood readiness and deterministic synthetic fixture only; do not treat as bundled third-party observational data, official Planck/Pantheon+/DESI/BOSS likelihood scoring, empirical validation, ASH preference evidence, or locked-prediction evidence.",
      "tracked_with": "git",
      "validation_status": "passed",
      "notes": "Manifest entry generated from the tracked repository file on 2026-06-28."
    },
    {
      "path": "data/ablation-results.csv",
      "original_path": null,
      "role": "generated-output",
      "format": "csv",
      "description": "Controlled simulation ablation summary data.",
      "size_bytes": 1437,
      "checksum_sha256": "abf4f54774eacd7ebbf17e6306330b6adb9d1f2da038d39d2a363677c2dc949a",
      "sensitivity": "public",
      "provenance": "Produced by repository artifact and simulation tools from tracked source code.",
      "license": "repository LICENSE",
      "usage_restrictions": "Respect repository scientific claim boundaries and source package provenance notes.",
      "tracked_with": "git",
      "validation_status": "passed",
      "notes": "Manifest entry generated from the tracked repository file on 2026-06-26."
    },
    {
      "path": "data/ash-cosmology/background-equations/v0.1/r012_ash_source_features.csv",
      "original_path": null,
      "role": "generated-output",
      "format": "csv",
      "description": "Roadmap 012 normalized finite ASH source feature table.",
      "size_bytes": 19010,
      "checksum_sha256": "20f133f06a255808020a7294ea691c1648f0a97485bbbe95874e0dab7193c60c",
      "sensitivity": "public",
      "provenance": "Produced by tools/generate_cosmological_background.py from tracked R-012 source code and configuration.",
      "license": "repository LICENSE",
      "usage_restrictions": "Synthetic finite-observer background-equation workbench only; do not treat as a physical FRW continuum, Einstein-equation derivation, external likelihood, empirical cosmology validation, CMB/matter-spectrum, modified-gravity, dark-sector detection, or locked-prediction evidence.",
      "tracked_with": "git",
      "validation_status": "passed",
      "notes": "Manifest entry generated from the tracked repository file on 2026-06-28."
    },
    {
      "path": "data/ash-cosmology/background-equations/v0.1/r012_background_ash.csv",
      "original_path": null,
      "role": "generated-output",
      "format": "csv",
      "description": "Roadmap 012 ASH-source synthetic background table.",
      "size_bytes": 85784,
      "checksum_sha256": "cdfaafd27416527bc0b4dccc927d7182c9e7818d1e73406003940985e29167e5",
      "sensitivity": "public",
      "provenance": "Produced by tools/generate_cosmological_background.py from tracked R-012 source code and configuration.",
      "license": "repository LICENSE",
      "usage_restrictions": "Synthetic finite-observer background-equation workbench only; do not treat as a physical FRW continuum, Einstein-equation derivation, external likelihood, empirical cosmology validation, CMB/matter-spectrum, modified-gravity, dark-sector detection, or locked-prediction evidence.",
      "tracked_with": "git",
      "validation_status": "passed",
      "notes": "Manifest entry generated from the tracked repository file on 2026-06-28."
    },
    {
      "path": "data/ash-cosmology/background-equations/v0.1/r012_background_covariance.csv",
      "original_path": null,
      "role": "generated-output",
      "format": "csv",
      "description": "Roadmap 012 synthetic background-observable covariance table.",
      "size_bytes": 570,
      "checksum_sha256": "e77d15d8ff697303e42b8e92ab38ce10e2bc4ffddec11ab85221f68e019edb6e",
      "sensitivity": "public",
      "provenance": "Produced by tools/generate_cosmological_background.py from tracked R-012 source code and configuration.",
      "license": "repository LICENSE",
      "usage_restrictions": "Synthetic finite-observer background-equation workbench only; do not treat as a physical FRW continuum, Einstein-equation derivation, external likelihood, empirical cosmology validation, CMB/matter-spectrum, modified-gravity, dark-sector detection, or locked-prediction evidence.",
      "tracked_with": "git",
      "validation_status": "passed",
      "notes": "Manifest entry generated from the tracked repository file on 2026-06-28."
    },
    {
      "path": "data/ash-cosmology/background-equations/v0.1/r012_background_lcdm.csv",
      "original_path": null,
      "role": "generated-output",
      "format": "csv",
      "description": "Roadmap 012 standard-baseline LCDM-limit background table.",
      "size_bytes": 85809,
      "checksum_sha256": "0c01c5f88824b726c857b0142a6347360c93beb0385ffbe82a53bf882d988608",
      "sensitivity": "public",
      "provenance": "Produced by tools/generate_cosmological_background.py from tracked R-012 source code and configuration.",
      "license": "repository LICENSE",